Authors,Title,Booktitle,Bookaddress,Year,Volume,Issue,Pages,Chapters,Cited by,Editors,Journals,Publisher,Conference name,Conference date,Conference location,ISBN,Document Type
"Carvalho J.R., Fortunato I.C., Fonseca C.G., Pezzarossa A., Barbacena P., Dominguez-Cejudo M.A., Vasconcelos F.F., Santos N.C., Carvalho F.A., Franco C.A.",Non-canonical Wnt signaling regulates junctional mechanocoupling during angiogenic collective cell migration,,,2019,8,1,,,33,,eLife,eLife Sciences Publications Ltd,,,,,Article
"Ichikawa T., Stuckenholz C., Davidson L.A.","Non-junctional role of Cadherin3 in cell migration and contact inhibition of locomotion via domain-dependent, opposing regulation of Rac1",,,2020,10,1,,,1,,Scientific Reports,Nature Research,,,,,Article
"Wei L., Al Oustah A., Blader P., Roussigné M.",Notch signaling restricts FGF pathway activation in parapineal cells to promote their collective migration,,,2019,8,1,,,4,,eLife,eLife Sciences Publications Ltd,,,,,Article
"Durán M., Burballa C., Cantero-Recasens G., Butnaru C.M., Malhotra V., Ariceta G., Sarró E., Meseguer A.",Novel Dent disease 1 cellular models reveal biological processes underlying ClC-5 loss-of-function,,,2021,30,15,1413-1428,,0,,Human Molecular Genetics,Oxford University Press,,,,,Article
"Kell M.J., Ang S.F., Pigati L., Halpern A., Fölsch H.",Novel function for AP-1B during cell migration,,,2020,31,22,2475-2493,,1,,Molecular Biology of the Cell,American Society for Cell Biology,,,,,Article
"Khoshnevisan R., Anderson M., Babcock S., Anderson S., Illig D., Marquardt B., Sherkat R., Schröder K., Moll F., Hollizeck S., Rohlfs M., Walz C., Adibi P., Rezaei A., Andalib A., Koletzko S., Muise A.M., Snapper S.B., Klein C., Thiagarajah J.R., Kotlarz D.",NOX1 regulates collective and planktonic cell migration: Insights from patients with pediatric-onset IBD and NOX1 deficiency,,,2020,26,8,1166-1176,,5,,Inflammatory Bowel Diseases,Oxford University Press,,,,,Article
"Bocci F., Tripathi S.C., Vilchez Mercedes S.A., George J.T., Casabar J.P., Wong P.K., Hanash S.M., Levine H., Onuchic J.N., Jolly M.K.",NRF2 activates a partial epithelial-mesenchymal transition and is maximally present in a hybrid epithelial/mesenchymal phenotype,,,2019,11,6,251-263,,57,,Integrative biology : quantitative biosciences from nano to macro,NLM (Medline),,,,,Article
"Vilchez Mercedes S.A., Bocci F., Ahmed M., Eder I., Zhu N., Levine H., Onuchic J.N., Jolly M.K., Wong P.K.",Nrf2 Modulates the Hybrid Epithelial/Mesenchymal Phenotype and Notch Signaling During Collective Cancer Migration,,,2022,9,1,,,0,,Frontiers in Molecular Biosciences,Frontiers Media S.A.,,,,,Article
"Chen W., Wang W., Sun X., Xie S., Xu X., Liu M., Yang C., Li M., Zhang W., Liu W., Wang L., Zhou T., Yang Y.",NudCL2 regulates cell migration by stabilizing both myosin-9 and LIS1 with Hsp90,,,2020,11,7,,,4,,Cell Death and Disease,Springer Nature,,,,,Article
"de Haan M., Zavodszky G., Azizi V., Hoekstra A. G.",Numerical investigation of the effects of red blood cell cytoplasmic viscosity contrasts on single cell and bulk transport behaviour,,,2018,8,9,,,12,,Applied Sciences (Switzerland),MDPI AG,,,,,Article
"Lin L., Zeng X.",Numerical investigation of the role of intercellular interactions on collective epithelial cell migration,,,2018,17,2,439-448,,4,,Biomechanics and Modeling in Mechanobiology,Springer Verlag,,,,,Article
"Cai L.-B., Ji W., Luo J., Lei Q.-L., Ma Y.-Q.",Numerical study of dynamic zigzag patterns in migrating epithelial tissue,,,2022,65,1,,,0,,"Science China: Physics, Mechanics and Astronomy",Science Press (China),,,,,Article
"Teryukova N. P., Malkova V. V., Sakhenberg E. I., Ivanov V. A., Bezborodkina N. N., Snopov S. A.",On reprogramming of tumor cells metabolism: detection of glycogen in the cell lines of hepatocellular origin with various degrees of dedifferentiation,,,2018,70,2,879-890,,3,,Cytotechnology,Springer Netherlands,,,,,Article
Fredberg J.J.,On the origins of order,,,2022,18,12,2346-2353,,0,,Soft Matter,Royal Society of Chemistry,,,,,Article
"Edgar L.T., Franco C.A., Gerhardt H., Bernabeu M.O.",On the preservation of vessel bifurcations during flow-mediated angiogenic remodelling,,,2021,17,2,,,2,,PLoS Computational Biology,Public Library of Science,,,,,Article
Ahlin T.,Only Near Is Dear? Doing Elderly Care with Everyday ICTs in Indian Transnational Families,,,2018,32,1,85-102,,26,,Medical Anthropology Quarterly,Wiley-Blackwell,,,,,Article
"Pramotton F.M., Robotti F., Giampietro C., Lendenmann T., Poulikakos D., Ferrari A.",Optimized Topological and Topographical Expansion of Epithelia,,,2019,5,8,3922-3934,,5,,ACS Biomaterials Science and Engineering,American Chemical Society,,,,,Article
"Tantengco O.A.G., Richardson L.S., Medina P.M.B., Han A., Menon R.",Organ-on-chip of the cervical epithelial layer: A platform to study normal and pathological cellular remodeling of the cervix,,,2021,35,4,,,6,,FASEB Journal,John Wiley and Sons Inc,,,,,Article
"Spennati G., Horowitz L.F., McGarry D.J., Rudzka D.A., Armstrong G., Olson M.F., Folch A., Yin H.",Organotypic platform for studying cancer cell metastasis,,,2021,401,2,,,2,,Experimental Cell Research,Elsevier Inc.,,,,,Article
"Petrolli V., Boudou T., Balland M., Cappello G.",Oscillations in collective cell migration,Viscoelasticity and Collective Cell Migration: An Interdisciplinary Perspective Across Levels of Organization,,2021,,,157-192,7,1,"Pajic-Lijakovic I., Barriga E. H.",Viscoelasticity and Collective Cell Migration: An Interdisciplinary Perspective Across Levels of Organization,Elsevier,,,,9780128203101,Book Chapter
"Verdejo-Torres O., Flores-Maldonado C., Padilla-Benavides T., Campos-Blázquez J.P., Larré I., Lara-Lemus R., Perez Salazar E., Cereijido M., Contreras R.G.",Ouabain Accelerates Collective Cell Migration Through a cSrc and ERK1/2 Sensitive Metalloproteinase Activity,,,2019,252,6,549-559,,3,,Journal of Membrane Biology,Springer New York LLC,,,,,Article
"Stock K., Borrink R., Mikesch J.-H., Hansmeier A., Rehkämper J., Trautmann M., Wardelmann E., Hartmann W., Sperveslage J., Steinestel K.",Overexpression and Tyr421-phosphorylation of cortactin is induced by three-dimensional spheroid culturing and contributes to migration and invasion of pancreatic ductal adenocarcinoma (PDAC) cells,,,2019,19,1,,,10,,Cancer Cell International,BioMed Central Ltd.,,,,,Article
"Shim G., Devenport D., Cohen D.J.",Overriding native cell coordination enhances external programming of collective cell migration,,,2021,118,29,,,3,,Proceedings of the National Academy of Sciences of the United States of America,National Academy of Sciences,,,,,Article
"Venhuizen J.-H., Span P.N., van den Dries K., Sommer S., Friedl P., Zegers M.M.",P120 catenin isoforms differentially associate with breast cancer invasion and metastasis,,,2019,11,10,,,6,,Cancers,MDPI AG,,,,,Article
"Gritsenko P.G., Atlasy N., Dieteren C.E.J., Navis A.C., Venhuizen J.-H., Veelken C., Schubert D., Acker-Palmer A., Westerman B.A., Wurdinger T., Leenders W., Wesseling P., Stunnenberg H.G., Friedl P.",p120-catenin-dependent collective brain infiltration by glioma cell networks,,,2020,22,1,97-107,,32,,Nature Cell Biology,Nature Research,,,,,Article
"Hirose S., Tabata Y., Sone K., Takahashi N., Yoshino D., Funamoto K.",P21-activated kinase regulates oxygen-dependent migration of vascular endothelial cells in monolayers,,,2021,15,1,272-284,,1,,Cell Adhesion and Migration,Taylor and Francis Ltd.,,,,,Article
"Scepanovic G., Hunter M.V., Kafri R., Fernandez-Gonzalez R.",p38-mediated cell growth and survival drive rapid embryonic wound repair,,,2021,37,3,,,1,,Cell Reports,Elsevier B.V.,,,,,Article
"Lin D., Chen X., Lin Z., Lin J., Liu Y., Liu D.",Paper-supported co-culture system for dynamic investigations of the lung-tropic migration of breast cancer cells,,,2021,16,2,,,0,,Biomedical Materials (Bristol),IOP Publishing Ltd,,,,,Article
"Byrne A.B., Brouillard P., Sutton D.L., Kazenwadel J., Montazaribarforoushi S., Secker G.A., Oszmiana A., Babic M., Betterman K.L., Brautigan P.J., White M., Piltz S.G., Thomas P.Q., Hahn C.N., Rath M., Felbor U., Korenke G.C., Smith C.L., Wood K.H., Sheppard S.E., Adams D.M., Kariminejad A., Helaers R., Boon L.M., Revencu N., Moore L., Barnett C., Haan E., Arts P., Vikkula M., Scott H.S., Harvey N.L.",Pathogenic variants in MDFIC cause recessive central conducting lymphatic anomaly with lymphedema,,,2022,14,634,,,1,,Science Translational Medicine,American Association for the Advancement of Science,,,,,Article
"Xu W., Alpha K.M., Zehrbach N.M., Turner C.E.",Paxillin promotes breast tumor collective cell invasion through maintenance of adherens junction integrity,,,2022,33,2,ar14-,,0,,Molecular biology of the cell,NLM (Medline),,,,,Article
"Borgne-Rochet M.L., Angevin L., Bazellières E., Ordas L., Comunale F., Denisov E.V., Tashireva L.A., Perelmuter V.M., Bièche I., Vacher S., Plutoni C., Seveno M., Bodin S., Gauthier-Rouvière C.",P-cadherin-induced decorin secretion is required for collagen fiber alignment and directional collective cell migration,,,2019,132,21,,,5,,Journal of Cell Science,Company of Biologists Ltd,,,,,Article
"Shindo A., Inoue Y., Kinoshita M., Wallingford J.B.",PCP-dependent transcellular regulation of actomyosin oscillation facilitates convergent extension of vertebrate tissue,,,2019,446,2,159-167,,15,,Developmental Biology,Elsevier Inc.,,,,,Article
"Nagel M., Winklbauer R.",PDGF-A suppresses contact inhibition during directional collective cell migration,,,2018,145,13,,,5,,Development (Cambridge),Company of Biologists Ltd,,,,,Article
"Tuguzbaeva G., Yue E., Chen X., He L., Li X., Ju J., Qin Y., Pavlov V., Lu Y., Jia W., Bai Y., Niu Y., Yang B.",PEP06 polypeptide 30 is a novel cluster-dissociating agent inhibiting αv integrin/FAK/Src signaling in oral squamous cell carcinoma cells,,,2019,9,6,1163-1173,,12,,Acta Pharmaceutica Sinica B,Chinese Academy of Medical Sciences,,,,,Article
"Knüsel S., Jenni A., Benninger M., Bütikofer P., Roditi I.",Persistence of Trypanosoma brucei as early procyclic forms and social motility are dependent on glycosylphosphatidylinositol transamidase,,,2022,117,4,802-817,,0,,Molecular Microbiology,John Wiley and Sons Inc,,,,,Article
"Moure A., Gomez H.",Phase-Field Modeling of Individual and Collective Cell Migration,,,2021,28,2,311-344,,9,,Archives of Computational Methods in Engineering,Springer Science and Business Media B.V.,,,,,Article
"Kim S.-K., Jang S.D., Kim H., Chung S., Park J.K., Kuh H.-J.",Phenotypic heterogeneity and plasticity of cancer cell migration in a pancreatic tumor three-dimensional culture model,,,2020,12,5,,,12,,Cancers,MDPI AG,,,,,Article
"La Porta C.A.M., Zapperi S.",Phenotypic plasticity: the emergence of cancer stem cells and collective cell migration,Successes and Challenges of NK Immunotherapy,,2020,,,639-649,10,1,"Levine H., Jolly M.K., Kulkarni P., Nanjundiah V.",Phenotypic Switching: Implications in Biology and Medicine,Elsevier,,,,9780128179963,Book Chapter
"Yamamoto S., Okada K., Sasaki N., Chang A.C., Yamaguchi K., Nakanishi J.","Photoactivatable Hydrogel Interfaces for Resolving the Interplay of Chemical, Mechanical, and Geometrical Regulation of Collective Cell Migration",,,2019,35,23,7459-7468,,6,,Langmuir,American Chemical Society,,,,,Article
"Abdellatef S. A., Nakanishi J.",Photoactivatable substrates for systematic study of the impact of an extracellular matrix ligand on appearance of leader cells in collective cell migration,,,2018,169,1,72-84,,8,,Biomaterials,Elsevier Ltd,,,,,Article
"Sentoku M., Hashimoto H., Iida K., Endo M., Yasuda K.",Photothermal agarose microfabrication technology for collective cell migration analysis,,,2021,12,9,,,1,,Micromachines,MDPI,,,,,Article
"Pan M., Yang Y., Liu L.",Physical Forces Influence the Self-organization of the Leader Cell Formation during Collective Cell Migration,,,2021,,,1923-1926,,0,,"Proceedings of the 16th Annual IEEE International Conference on Nano/Micro Engineered and Molecular Systems, NEMS 2021",Institute of Electrical and Electronics Engineers Inc.,16th Annual IEEE International Conference on Nano/Micro Engineered and Molecular Systems,25-Apr-21,"Xiamen, China",9781665419413,Conference Paper
"Gómez-Escudero J., Clemente C., García-Weber D., Acín-Pérez R., Millán J., Enríquez J.A., Bentley K., Carmeliet P., Arroyo A.G.",PKM2 regulates endothelial cell junction dynamics and angiogenesis via ATP production,,,2019,9,1,,,18,,Scientific Reports,Nature Publishing Group,,,,,Article
"Stedden C.G., Menegas W., Zajac A.L., Williams A.M., Cheng S., Özkan E., Horne-Badovinac S.",Planar-Polarized Semaphorin-5c and Plexin A Promote the Collective Migration of Epithelial Cells in Drosophila,,,2019,29,6,908-920,,18,,Current Biology,Cell Press,,,,,Article
"Cheng C. -C., Chao W. -T., Liao C. -C., Tseng Y. -H., Lai Y. -C. C., Lai Y. -S., Hsu Y. -H., Liu Y. -H.",Plectin deficiency in liver cancer cells promotes cell migration and sensitivity to sorafenib treatment,,,2018,12,1,19-27,,12,,Cell Adhesion and Migration,Taylor and Francis Inc.,,,,,Article
"Shen H., He M., Lin R., Zhan M., Xu S., Huang X., Xu C., Chen W., Yao Y., Mohan M., Wang J.",PLEK2 promotes gallbladder cancer invasion and metastasis through EGFR/CCL2 pathway,,,2019,38,1,,,25,,Journal of Experimental and Clinical Cancer Research,BioMed Central Ltd.,,,,,Article
"Ghosh D., Dutta A., Kashyap A., Upmanyu N., Datta S.",PLP2 drives collective cell migration via ZO-1-mediated cytoskeletal remodeling at the leading edge in human colorectal cancer cells,,,2021,134,18,,,0,,Journal of Cell Science,Company of Biologists Ltd,,,,,Article
"Hayakawa M., Hiraiwa T., Wada Y., Kuwayama H., Shibata T.",Polar pattern formation induced by contact following locomotion in a multicellular system,,,2020,9,1,,,9,,eLife,eLife Sciences Publications Ltd,,,,,Article
"Jia N., Liu J., Zhu G., Liang Y., Wang Y., Wang W., Chen Y., Yang J., Zhang W., Zhang J.",Polarization of ADAM17-driven EGFR signalling in electric field-guided collective migration of epidermal sheets,,,2020,24,23,14073-14085,,1,,Journal of Cellular and Molecular Medicine,Blackwell Publishing Inc.,,,,,Article
"Oelz D., Khataee H., Czirok A., Neufeld Z.",Polarization wave at the onset of collective cell migration,,,2019,100,3,,,5,,Physical Review E,American Physical Society,,,,,Article
"Okuda S., Sato K.","Polarized interfacial tension induces collective migration of cells, as a cluster, in a 3D tissue",,,2022,121,10,1856-1867,,0,,Biophysical Journal,Biophysical Society,,,,,Article
"Beaune G., Nagarajan U., Brochard-Wyart F., Winnik F.M.",Polymeric Nanoparticles Limit the Collective Migration of Cellular Aggregates,,,2019,35,23,7396-7404,,6,,Langmuir,American Chemical Society,,,,,Article
"Page D.J., Thuret R., Venkatraman L., Takahashi T., Bentley K., Herbert S.P.","Positive Feedback Defines the Timing, Magnitude, and Robustness of Angiogenesis",,,2019,27,11,3139-3151,,15,,Cell Reports,Elsevier B.V.,,,,,Article
"Lee J. H., Choi Y. J., Park S. -H., Nam M. J.",Potential role of nucleoside diphosphate kinase in myricetin-induced selective apoptosis in colon cancer HCT-15 cells,,,2018,116,1,315-322,,15,,Food and Chemical Toxicology,Elsevier Ltd,,,,,Article
"Mathur J., Sarker B., Pathak A.",Predicting Collective Migration of Cell Populations Defined by Varying Repolarization Dynamics,,,2018,115,12,2474-2485,,4,,Biophysical Journal,Biophysical Society,,,,,Article
De Lora J.,Preprint Highlight: Disentangling cadherin-mediated cell-cell interactions in collective cancer cell migration,,,2022,33,5,,,0,,Molecular biology of the cell,NLM (Medline),,,,,Article
"Raghuraman S., Schubert A.-S., Bröker S., Jurado A., Müller A., Brandt M., Vos B.E., Hofemeier A.D., Abbasi F., Stehling M., Wittkowski R., Ivaska J., Betz T.",Pressure Drives Rapid Burst-Like Coordinated Cellular Motion from 3D Cancer Aggregates,,,2022,9,6,,,1,,Advanced Science,John Wiley and Sons Inc,,,,,Article
"Metzner C., Lange J., Krauss P., Wunderling N., Übelacker J., Martin F., Fabry B.",Pressure-driven collective growth mechanism of planar cell colonies,,,2018,51,30,,,0,,Journal of Physics D: Applied Physics,Institute of Physics Publishing,,,,,Article
"Ahsan K., Singh N., Rocha M., Huang C., Prince V.E.",Prickle1 is required for EMT and migration of zebrafish cranial neural crest,,,2019,448,1,16-35,,16,,Developmental Biology,Elsevier Inc.,,,,,Article
"Voelker H.-U., Hintermeier I., Strehl A., Scheich M.",Prognostic potential of the expression of podoplanin (D2-40) within cells of squamous cell carcinoma of the larynx and hypopharynx,,,2020,11,2,65-71,,2,,World Journal of Oncology,Elmer Press,,,,,Article
"Imashiro C., Kang B., Lee Y., Hwang Y.-H., Im S., Kim D.-E., Takemura K., Lee H.",Propagating acoustic waves on a culture substrate regulate the directional collective cell migration,,,2021,7,1,,,3,,Microsystems and Nanoengineering,Springer Nature,,,,,Article
"Fox E.F., Lamb M.C., Mellentine S.Q., Tootle T.L.","Prostaglandins regulate invasive, collective border cell migration",,,2020,31,15,1584-1594,,2,,Molecular Biology of the Cell,American Society for Cell Biology,,,,,Article
"Chen Y., Kotian N., Aranjuez G., Chen L., Messer C.L., Burtscher A., Sawant K., Ramel D., Wang X., McDonald J.A.",Protein phosphatase 1 activity controls a balance between collective and single cell modes of migration,,,2020,9,1,,,5,,eLife,eLife Sciences Publications Ltd,,,,,Article
"Wheeler G.E., Purkayastha A., Bunker E.N., Bortz D.M., Liu X.",Protocol for Analysis and Consolidation of TrackMate Outputs for Measuring Two-Dimensional Cell Motility using Nuclear Tracking,,,2021,,178,,,0,,Journal of visualized experiments : JoVE,NLM (Medline),,,,,Article
"van de Merbel A. F., van der Horst G., Buijs J. T., van der Pluijm G.",Protocols for migration and invasion studies in prostate cancer,Prostate Cancer,New York,2018,1786,1,67-79,,25,Culig Z.,Methods in Molecular Biology,Humana Press Inc.,,,,,Book Chapter
"Šeklić D.S., Jovanović M.M., Virijević K.D., Grujić J.N., Živanović M.N., Marković S.D.",Pseudevernia furfuracea inhibits migration and invasion of colorectal carcinoma cell lines,,,2022,284,1,,,0,,Journal of Ethnopharmacology,Elsevier Ireland Ltd,,,,,Article
"Wang X.-H., Yang F., Pan J.-B., Kang B., Xu J.-J., Chen H.-Y.",Quantitative Imaging of pN Intercellular Force and Energetic Costs during Collective Cell Migration in Epithelial Wound Healing,,,2020,92,24,16180-16187,,6,,Analytical Chemistry,American Chemical Society,,,,,Article
"Pereyra M., Drusko A., Krämer F., Strobl F., Stelzer E.H.K., Matthäus F.",QuickPIV: Efficient 3D particle image velocimetry software applied to quantifying cellular migration during embryogenesis,,,2021,22,1,,,0,,BMC Bioinformatics,BioMed Central Ltd,,,,,Article
"Kang A.-R., Cho J.H., Lee N.-G., Kwon J.-H., Song J.-Y., Hwang S.-G., Jung I.S., Kim J.-S., Um H.-D., Oh S.C., Park J.K.",Radiation-induced IL-1β expression and secretion promote cancer cell migration/invasion via activation of the NF-κB–RIP1 pathway,,,2021,534,1,973-979,,1,,Biochemical and Biophysical Research Communications,Elsevier B.V.,,,,,Article
"Hwang P.Y., Brenot A., King A.C., Longmore G.D., George S.C.",Randomly distributed K14þ breast tumor cells polarize to the leading edge and guide collective migration in response to chemical and mechanical environmental cues,,,2019,79,8,1899-1912,,24,,Cancer Research,American Association for Cancer Research Inc.,,,,,Article
"Sawant K., Chen Y., Kotian N., Preuss K.M., McDonald J.A.",Rap1 GTPase promotes coordinated collective cell migration in vivo,,,2018,29,22,2656-2673,,11,,Molecular Biology of the Cell,American Society for Cell Biology,,,,,Article
"Chang Y. -C., Wu J. -W., Hsieh Y. -C., Huang T. -H., Liao Z. -M., Huang Y. -S., Mondo J. A., Montell D., Jang A. C. -C.",Rap1 Negatively Regulates the Hippo Pathway to Polarize Directional Protrusions in Collective Cell Migration,,,2018,22,8,2160-2175,,14,,Cell Reports,Elsevier B.V.,,,,,Article
"Nan H., Liang L., Chen G., Liu L., Liu R., Jiao Y.",Realizations of highly heterogeneous collagen networks via stochastic reconstruction for micromechanical analysis of tumor cell invasion,,,2018,97,3,,,17,,Physical Review E,American Physical Society,,,,,Article
"Herrington C.S., Poulsom R., Coates P.J.",Recent Advances in Pathology: the 2020 Annual Review Issue of The Journal of Pathology,,,2020,250,5,475-479,,2,,Journal of Pathology,John Wiley and Sons Ltd,,,,,Article
"van der Bijl I., Nawaz K., Kazlauskaite U., van Stalborch A.-M., Tol S., Jimenez Orgaz A., van den Bout I., Reinhard N.R., Sonnenberg A., Margadant C.",Reciprocal integrin/integrin antagonism through kindlin-2 and Rho GTPases regulates cell cohesion and collective migration,,,2020,93,1,60-78,,8,,Matrix Biology,Elsevier B.V.,,,,,Article
"Roycroft A., Szabó A., Bahm I., Daly L., Charras G., Parsons M., Mayor R.",Redistribution of Adhesive Forces through Src/FAK Drives Contact Inhibition of Locomotion in Neural Crest,,,2018,45,5,565-579,,21,,Developmental Cell,Cell Press,,,,,Article
"Lin S., Hirayama D., Maryu G., Matsuda K., Hino N., Deguchi E., Aoki K., Iwamoto R., Terai K., Matsuda M.",Redundant roles of EGFR ligands in the ERK activation waves during collective cell migration,,,2022,5,1,,,2,,Life Science Alliance,Rockefeller University Press,,,,,Article
"Costa P., Blowes L.M., Laly A.C., Connelly J.T.",Regulation of collective cell polarity and migration using dynamically adhesive micropatterned substrates,,,2021,126,1,291-300,,2,,Acta Biomaterialia,Acta Materialia Inc,,,,,Article
"Wrenn E.D., Yamamoto A., Moore B.M., Huang Y., McBirney M., Thomas A.J., Greenwood E., Rabena Y.F., Rahbar H., Partridge S.C., Cheung K.J.",Regulation of Collective Metastasis by Nanolumenal Signaling,,,2020,183,2,395-410,,21,,Cell,Cell Press,,,,,Article
"Alonso F., Spuul P., Decossas M., Egaña I., Curado F., Fremaux I., Daubon T., Génot E.",Regulation of podosome formation in aortic endothelial cells vessels by physiological extracellular cues,,,2020,99,4,,,1,,European Journal of Cell Biology,Elsevier GmbH,,,,,Article
"Myat M.M., Louis D., Mavrommatis A., Collins L., Mattis J., Ledru M., Verghese S., Su T.T.",Regulators of cell movement during development and regeneration in Drosophila,,,2019,9,5,,,7,,Open Biology,Royal Society Publishing,,,,,Article
"Karaiwa A., Yamada S., Yamamoto H., Wakasa M., Ishijima H., Akiyama R., Hosokawa Y., Bessho Y., Matsui T.",Relationship between surrounding tissue morphology and directional collective migration of the posterior lateral line primordium in zebrafish,,,2020,25,8,582-592,,0,,Genes to Cells,Blackwell Publishing Ltd,,,,,Article
"Suveges S., Eftimie R., Trucu D.",Re-polarisation of Macrophages Within Collective Tumour Cell Migration: A Multiscale Moving Boundary Approach,,,2022,7,1,,,0,,Frontiers in Applied Mathematics and Statistics,Frontiers Media S.A.,,,,,Article
"Yokoyama M., Senoo M., Kage A., Mogami Y.",Responses of Bioconvection of Tetrahymena thermophila to Partial Gravity Created by Aircraft Flight,,,2019,36,2,159-166,,0,,Zoological Science,Zoological Society of Japan,,,,,Article
"Gu S., Liu Y., Zou J., Wang W., Wei T., Wang X., Zhu L., Zhang M., Zhu J., Xie T., Yao Y., Qiu L.",Retinal pigment epithelial cells secrete miR-202-5p-containing exosomes to protect against proliferative diabetic retinopathy,,,2020,201,1,,,11,,Experimental Eye Research,Academic Press,,,,,Article
"Ishii M., Tateya T., Matsuda M., Hirashima T.",Retrograde erk activation waves drive base-to-apex multicellular flow in murine cochlear duct morphogenesis,,,2021,10,1,,,8,,eLife,eLife Sciences Publications Ltd,,,,,Article
"Chojowski R., Schwarz U.S., Ziebert F.",Reversible elastic phase field approach and application to cell monolayers,,,2020,43,10,,,0,,European Physical Journal E,Springer Science and Business Media Deutschland GmbH,,,,,Article
"Kang A.-R., Cho J.H., Lee N.-G., Song J.-Y., Hwang S.-G., Lee D.-H., Um H.-D., Park J.K.",RIP1 is a novel component of γ-ionizing radiation-induced invasion of non-small cell lung cancer cells,,,2020,21,13,,,4,,International Journal of Molecular Sciences,MDPI AG,,,,,Article
"Pang Y., Yang J., Hui Z., Grottkau B. E.",Robotic Patterning a Superhydrophobic Surface for Collective Cell Migration Screening,,,2018,24,4,205-213,,5,,Tissue Engineering - Part C: Methods,Mary Ann Liebert Inc.,,,,,Article
"Libanje F., Raingeaud J., Luan R., Thomas Z., Zajac O., Veiga J., Marisa L., Adam J., Boige V., Malka D., Goéré D., Hall A., Soazec J.-Y., Prall F., Gelli M., Dartigues P., Jaulin F.",ROCK2 inhibition triggers the collective invasion of colorectal adenocarcinomas,,,2019,38,14,,,27,,EMBO Journal,Wiley-VCH Verlag,,,,,Article
"Bajpai S., Prabhakar R., Chelakkot R., Inamdar M.M.",Role of cell polarity dynamics and motility in pattern formation due to contact-dependent signalling,,,2021,18,175,,,1,,Journal of the Royal Society Interface,Royal Society Publishing,,,,,Article
"Alert R., Casademunt J.",Role of Substrate Stiffness in Tissue Spreading: Wetting Transition and Tissue Durotaxis,,,2019,35,23,7571-7577,,13,,Langmuir,American Chemical Society,,,,,Article
"Liu Y., Cheng J., Yang H., Xu G.-K.",Rotational constraint contributes to collective cell durotaxis,,,2020,117,21,,,1,,Applied Physics Letters,American Institute of Physics Inc.,,,,,Article
"Singh J., Pagulayan A., Camley B.A., Nain A.S.",Rules of contact inhibition of locomotion for cells on suspended nanofibers,,,2021,118,12,,,2,,Proceedings of the National Academy of Sciences of the United States of America,National Academy of Sciences,,,,,Article
